{
  "schema_version": "1.0.0",
  "updated_at": "2026-03-30T09:31:24.892072+00:00",
  "source": "TSE DivulgaCandContas REST API + BrasilAPI",
  "source_url": "https://divulgacandcontas.tse.jus.br",
  "disclaimer_pt": "Dados de financiamento de campanha das eleições 2022. Doações de pessoas jurídicas foram proibidas pelo STF (ADI 4650) em 2016, mas podem existir registros históricos ou doações via fundo partidário.",
  "disclaimer_en": "2022 campaign finance data. Corporate donations were banned by the Brazilian Supreme Court (ADI 4650) in 2016, but historical records or party fund donations may exist.",
  "election_year": 2022,
  "total_candidates": 9,
  "total_donations": 0,
  "total_amount": 0.0,
  "candidates": {
    "lula": {
      "slug": "lula",
      "sq_candidato": null,
      "sq_prestador": null,
      "donations": [],
      "summary": {
        "total_donations": 0,
        "total_amount": 0.0,
        "pf_count": 0,
        "pf_amount": 0.0,
        "pj_count": 0,
        "pj_amount": 0.0
      },
      "sector_breakdown": null,
      "no_2022_race": true,
      "collected_at": "2026-03-30T09:31:24.891626+00:00"
    },
    "flavio-bolsonaro": {
      "slug": "flavio-bolsonaro",
      "sq_candidato": null,
      "sq_prestador": null,
      "donations": [],
      "summary": {
        "total_donations": 0,
        "total_amount": 0.0,
        "pf_count": 0,
        "pf_amount": 0.0,
        "pj_count": 0,
        "pj_amount": 0.0
      },
      "sector_breakdown": null,
      "no_2022_race": true,
      "collected_at": "2026-03-30T09:31:24.891702+00:00"
    },
    "tarcisio": {
      "slug": "tarcisio",
      "sq_candidato": null,
      "sq_prestador": null,
      "donations": [],
      "summary": {
        "total_donations": 0,
        "total_amount": 0.0,
        "pf_count": 0,
        "pf_amount": 0.0,
        "pj_count": 0,
        "pj_amount": 0.0
      },
      "sector_breakdown": null,
      "no_2022_race": true,
      "collected_at": "2026-03-30T09:31:24.891759+00:00"
    },
    "caiado": {
      "slug": "caiado",
      "sq_candidato": null,
      "sq_prestador": null,
      "donations": [],
      "summary": {
        "total_donations": 0,
        "total_amount": 0.0,
        "pf_count": 0,
        "pf_amount": 0.0,
        "pj_count": 0,
        "pj_amount": 0.0
      },
      "sector_breakdown": null,
      "no_2022_race": true,
      "collected_at": "2026-03-30T09:31:24.891812+00:00"
    },
    "zema": {
      "slug": "zema",
      "sq_candidato": null,
      "sq_prestador": null,
      "donations": [],
      "summary": {
        "total_donations": 0,
        "total_amount": 0.0,
        "pf_count": 0,
        "pf_amount": 0.0,
        "pj_count": 0,
        "pj_amount": 0.0
      },
      "sector_breakdown": null,
      "no_2022_race": true,
      "collected_at": "2026-03-30T09:31:24.891862+00:00"
    },
    "ratinho-jr": {
      "slug": "ratinho-jr",
      "sq_candidato": null,
      "sq_prestador": null,
      "donations": [],
      "summary": {
        "total_donations": 0,
        "total_amount": 0.0,
        "pf_count": 0,
        "pf_amount": 0.0,
        "pj_count": 0,
        "pj_amount": 0.0
      },
      "sector_breakdown": null,
      "no_2022_race": true,
      "collected_at": "2026-03-30T09:31:24.891912+00:00"
    },
    "eduardo-leite": {
      "slug": "eduardo-leite",
      "sq_candidato": null,
      "sq_prestador": null,
      "donations": [],
      "summary": {
        "total_donations": 0,
        "total_amount": 0.0,
        "pf_count": 0,
        "pf_amount": 0.0,
        "pj_count": 0,
        "pj_amount": 0.0
      },
      "sector_breakdown": null,
      "no_2022_race": true,
      "collected_at": "2026-03-30T09:31:24.891959+00:00"
    },
    "aldo-rebelo": {
      "slug": "aldo-rebelo",
      "sq_candidato": null,
      "sq_prestador": null,
      "donations": [],
      "summary": {
        "total_donations": 0,
        "total_amount": 0.0,
        "pf_count": 0,
        "pf_amount": 0.0,
        "pj_count": 0,
        "pj_amount": 0.0
      },
      "sector_breakdown": null,
      "no_2022_race": true,
      "collected_at": "2026-03-30T09:31:24.892007+00:00"
    },
    "renan-santos": {
      "slug": "renan-santos",
      "sq_candidato": null,
      "sq_prestador": null,
      "donations": [],
      "summary": {
        "total_donations": 0,
        "total_amount": 0.0,
        "pf_count": 0,
        "pf_amount": 0.0,
        "pj_count": 0,
        "pj_amount": 0.0
      },
      "sector_breakdown": null,
      "no_2022_race": true,
      "collected_at": "2026-03-30T09:31:24.892054+00:00"
    }
  }
}